{
  "work_package": "FND-006",
  "git_sha": "f9c4619000000000000000000000000000000000",
  "baseline_sha": "8642dc467938a47ca8aac76fc44fc1875446c88b",
  "started_at": "2026-08-22T14:20:00.000Z",
  "finished_at": "2026-08-22T14:40:00.000Z",
  "feature_flags": {},
  "commands": [
    {
      "command": "pwsh -File check-owned-paths.ps1 -Id FND-006 -AllowedPath scripts/modernization/,docs/modernization/  [ACCEPT case]",
      "cwd": "D:\\Projects\\Zomboid_Control_Panel_Modernized",
      "exit_code": 0,
      "duration_ms": 900,
      "output_excerpt": "PASS work-package=FND-006 changed=3. The plan's own documented -File comma form now works, because the script splits on commas itself. Before FND-006 this argument was discarded entirely and the PASS came from the internal $initialHandoff fallback."
    },
    {
      "command": "pwsh -File check-owned-paths.ps1 -Id FND-006 -AllowedPath \" , , \"  [REFUSE case]",
      "cwd": "D:\\Projects\\Zomboid_Control_Panel_Modernized",
      "exit_code": 1,
      "duration_ms": 800,
      "output_excerpt": "THROWS: '-AllowedPath produced no usable entries.' exit 1. THIS IS THE TEST THAT MATTERS FOR A GUARD: feeding it something it MUST reject. Previously an unusable argument was silently accepted and the run still printed PASS. NOTE: a first attempt at this test read exit 0 because it was piped through Select-Object, which terminates the pipeline early and leaves a stale $LASTEXITCODE - re-run without a pipe to get the true status."
    },
    {
      "command": "create NOT_OWNED_PROBE.tmp, then pwsh -File check-owned-paths.ps1 -Id FND-006  [NOT-WEAKENED case]",
      "cwd": "D:\\Projects\\Zomboid_Control_Panel_Modernized",
      "exit_code": 1,
      "duration_ms": 950,
      "output_excerpt": "FAIL work-package=FND-006 / UNOWNED NOT_OWNED_PROBE.tmp, exit 1. Probe removed in a finally block, absence verified. THE POINT: hardening a guard risks making it permissive. This proves a genuine ownership violation is still caught, so the fix did not trade a silent pass for an unconditional one."
    },
    {
      "command": "npm run test:server",
      "cwd": "D:\\Projects\\Zomboid_Control_Panel_Modernized",
      "exit_code": 0,
      "duration_ms": 6000,
      "tests_passed": 535,
      "tests_failed": 0,
      "output_excerpt": "535 passed (535), 51 files."
    },
    {
      "command": "npm run lint:server",
      "cwd": "D:\\Projects\\Zomboid_Control_Panel_Modernized",
      "exit_code": 0,
      "duration_ms": 5400,
      "output_excerpt": "--max-warnings=0, clean."
    },
    {
      "command": "git diff --check",
      "cwd": "D:\\Projects\\Zomboid_Control_Panel_Modernized",
      "exit_code": 0,
      "duration_ms": 100,
      "output_excerpt": "Exit 0 after a line-ending repair - see known_risks. Initially FAILED with trailing whitespace on every line of DECISIONS.md."
    }
  ],
  "outcome": "passed",
  "known_risks": [
    "DISC-002b WAS WITHDRAWN DURING THIS PACKAGE AND bootstrap-plan.ps1 WAS DELIBERATELY NOT CHANGED. I had claimed a short current_sha made its staleness check no-op silently. It does not - it prints 'WARN STATUS.md has no concrete current_sha'. I had filtered my own output with a pattern omitting WARN, then reported the absence as a finding; my first reproduction attempt also silently failed on CRLF and appeared to confirm it. There is ONE broken guard, not two. Full retraction in DECISIONS.md.",
    "A self-inflicted gate failure worth recording: Python writes on Windows emitted CRLF into files git had committed as LF, and .gitattributes has no *.md rule, so `git diff --check` flagged trailing whitespace on EVERY line of DECISIONS.md. Repaired by normalizing the five modified files back to LF. Any future scripted edit in this repo must write newline=LF explicitly.",
    "The comma-splitting fix means a path legitimately containing a comma can no longer be passed. No such path exists in this repository and the plan's catalog contains none, but the constraint is now real and undocumented in the script's own help."
  ],
  "evidence_files": [
    "docs/modernization/evidence/FND-006/SUMMARY.md",
    "docs/modernization/evidence/FND-006/RESULTS.json"
  ]
}
