{
  "work_package": "FND-005",
  "git_sha": "e966fe94c7d6aca60986c7704a80e576bc1fa9f3",
  "baseline_sha": "8642dc467938a47ca8aac76fc44fc1875446c88b",
  "started_at": "2026-08-22T13:30:00.000Z",
  "finished_at": "2026-08-22T13:37:00.000Z",
  "feature_flags": {},
  "commands": [
    {
      "command": "cleanup + npm run test:server (FALSIFIER: does the fix stop the artifacts AND leave discovery untouched?)",
      "cwd": "D:\\Projects\\Zomboid_Control_Panel_Modernized",
      "exit_code": 0,
      "duration_ms": 4730,
      "tests_passed": 535,
      "tests_failed": 0,
      "output_excerpt": "PRE: db.json=False backups=False logs=False pathsconfig=False. Test Files 51 passed (51). Tests 535 passed (535). POST: db.json=False backups=False logs=False pathsconfig=False. BOTH acceptance criteria met: no repo artifacts created, AND the count is unchanged at 535/51 so the new root vitest.config.js did not alter test discovery."
    },
    {
      "command": "pwsh -File .\\scripts\\modernization\\bootstrap-plan.ps1 (immediately after a gate run)",
      "cwd": "D:\\Projects\\Zomboid_Control_Panel_Modernized",
      "exit_code": 0,
      "duration_ms": 1200,
      "output_excerpt": "PASS runtime-db-absent / RESULT=PASS. Before FND-005 this threw exit 1 at this exact point."
    },
    {
      "command": "npm run lint:server",
      "cwd": "D:\\Projects\\Zomboid_Control_Panel_Modernized",
      "exit_code": 0,
      "duration_ms": 5200,
      "output_excerpt": "eslint server eslint-rules --max-warnings=0, no findings. Confirms the new server/tests/vitest.globalSetup.mjs passes the project's own lint rules."
    },
    {
      "command": "npx vitest run (client -- root config must NOT leak into the client suite)",
      "cwd": "D:\\Projects\\Zomboid_Control_Panel_Modernized\\client",
      "exit_code": 0,
      "duration_ms": 5850,
      "tests_passed": 90,
      "tests_failed": 0,
      "output_excerpt": "Test Files 14 passed (14). Tests 90 passed (90). Unchanged from the FND-001 baseline, confirming the new root config does not affect the client project, which resolves its own client/vite.config.ts."
    },
    {
      "command": ".\\node_modules\\.bin\\tsc.cmd -b --pretty false",
      "cwd": "D:\\Projects\\Zomboid_Control_Panel_Modernized\\client",
      "exit_code": 0,
      "duration_ms": 3100,
      "output_excerpt": "No diagnostics."
    },
    {
      "command": "npm run build",
      "cwd": "D:\\Projects\\Zomboid_Control_Panel_Modernized\\client",
      "exit_code": 0,
      "duration_ms": 12000,
      "output_excerpt": "Build succeeded. Same >500 kB chunk advisory as baseline (RISK-004), unchanged."
    },
    {
      "command": "git diff --check",
      "cwd": "D:\\Projects\\Zomboid_Control_Panel_Modernized",
      "exit_code": 0,
      "duration_ms": 90,
      "output_excerpt": "Clean."
    },
    {
      "command": "npm run test:server (SECOND consecutive run) then bootstrap-plan.ps1 -- THE ACTUAL PROOF",
      "cwd": "D:\\Projects\\Zomboid_Control_Panel_Modernized",
      "exit_code": 0,
      "duration_ms": 6000,
      "tests_passed": 535,
      "tests_failed": 0,
      "output_excerpt": "Tests 535 passed (535), exit 0; then PASS runtime-db-absent / RESULT=PASS, exit 0. THIS IS THE DEFECT ACTUALLY CLOSED: before FND-005 the documented FND-001 sequence could not be executed twice, because its own gate created the file its own preflight forbids. It now can."
    }
  ],
  "outcome": "passed",
  "known_risks": [
    "A root vitest.config.js now exists where none did before. It sets globalSetup and nothing else, deliberately, so stock discovery behaviour is preserved -- evidenced by the count staying at exactly 535 tests / 51 files. Any future edit to this file must re-check that count, because a changed include glob would silently drop tests while still reporting green.",
    "The setup DELIBERATELY DOES NOT ISOLATE when a paths.config.json already exists: it logs and leaves the file alone. A developer pointing the panel at a real data root would therefore still see the suite write to that root. This is the intended trade -- silently clobbering a real override would be far worse than the defect being fixed -- but it means isolation is conditional, not absolute.",
    "Isolation depends on globalSetup running before workers import server/database/init.js. That ordering holds because getDataPaths() memoizes at first import and globalSetup runs in the main process before workers spawn. A future move of this logic to setupFiles would be too late and would silently stop working -- the symptom would be the return of data/db.json, not a test failure."
  ],
  "evidence_files": [
    "docs/modernization/evidence/FND-005/SUMMARY.md",
    "docs/modernization/evidence/FND-005/RESULTS.json",
    "docs/modernization/evidence/FND-005/DIFF_SCOPE.md",
    "docs/modernization/evidence/FND-005/ROLLBACK.md",
    "docs/modernization/DECISIONS.md"
  ]
}
